<?xml version="1.0" encoding="UTF-8"?>
<xs:schema xmlns:xs="http://www.w3.org/2001/XMLSchema">
    <xs:element name="escuela">
        <xs:complexType>
            <xs:sequence>
                <xs:element name="alumno" maxOccurs="unbounded">
                    <xs:complexType>
                        <xs:sequence>
                            <xs:element name="nombre" type="xs:string"/>
                            <xs:element name="edad" type="xs:int"/>
                            <xs:element name="cursos">
                                <xs:complexType>
                                    <xs:sequence>
                                        <xs:element name="curso" maxOccurs="unbounded">
                                            <xs:complexType>
                                                <xs:sequence>
                                                    <xs:element name="nombreCurso" type="xs:string"/>
                                                </xs:sequence>
                                                <xs:attribute name="calificacion" type="xs:string"/>
                                            </xs:complexType>
                                        </xs:element>
                                    </xs:sequence>
                                </xs:complexType>
                            </xs:element>
                        </xs:sequence>
                        <xs:attribute name="id" type="xs:ID"/>
                    </xs:complexType>
                </xs:element>
            </xs:sequence>
        </xs:complexType>
    </xs:element>
</xs:schema>